{
  "drawdown_brakes": [
    {
      "drawdown": 0.08,
      "gross_scale": 0.7
    },
    {
      "drawdown": 0.16,
      "gross_scale": 0.35
    },
    {
      "drawdown": 0.24,
      "gross_scale": 0.0
    }
  ],
  "policy_id": "team-07-v3-controlled",
  "position_stop": {
    "cooldown_bars": 3,
    "enabled": true,
    "loss_fraction": 0.07
  },
  "same_boundary_reentry": false,
  "schema_version": 1,
  "side_scaling": {
    "long_scale": 1.0,
    "short_scale": 1.0
  },
  "time_stop": {
    "cooldown_bars": 3,
    "enabled": true,
    "maximum_holding_bars": 6
  },
  "turnover_limit": {
    "enabled": true,
    "maximum_one_way_turnover": 0.25
  },
  "volatility_target": {
    "annualized_target": 0.28,
    "enabled": true,
    "lookback_days": 21,
    "maximum_scale": 1.0,
    "minimum_scale": 0.2
  }
}
