{
  "drawdown_brakes": [
    {
      "drawdown": 0.08,
      "gross_scale": 0.7
    },
    {
      "drawdown": 0.15,
      "gross_scale": 0.35
    },
    {
      "drawdown": 0.22,
      "gross_scale": 0
    }
  ],
  "policy_id": "t07-confirm-z000-f21-b28-h7-g5500-v5",
  "position_stop": {
    "cooldown_bars": 9,
    "enabled": true,
    "loss_fraction": 0.1
  },
  "same_boundary_reentry": false,
  "schema_version": 1,
  "side_scaling": {
    "long_scale": 1,
    "short_scale": 1
  },
  "time_stop": {
    "cooldown_bars": 0,
    "enabled": false,
    "maximum_holding_bars": 84
  },
  "turnover_limit": {
    "enabled": true,
    "maximum_one_way_turnover": 0.12
  },
  "volatility_target": {
    "annualized_target": 0.25,
    "enabled": true,
    "lookback_days": 42,
    "maximum_scale": 1,
    "minimum_scale": 0.2
  }
}
