{
  "drawdown_brakes": [],
  "policy_id": "t02-breakout-buffer-sign-inversion-v1",
  "position_stop": {
    "cooldown_bars": 12,
    "enabled": false,
    "loss_fraction": 0.06
  },
  "same_boundary_reentry": false,
  "schema_version": 1,
  "side_scaling": {
    "long_scale": 1,
    "short_scale": 1
  },
  "time_stop": {
    "cooldown_bars": 6,
    "enabled": false,
    "maximum_holding_bars": 42
  },
  "turnover_limit": {
    "enabled": false,
    "maximum_one_way_turnover": 0.1
  },
  "volatility_target": {
    "annualized_target": 0.22,
    "enabled": false,
    "lookback_days": 30,
    "maximum_scale": 1,
    "minimum_scale": 0.15
  }
}
