{
  "schema_version": 1,
  "policy_id": "team-12-flat",
  "same_boundary_reentry": true,
  "volatility_target": {
    "enabled": false, "lookback_days": 30, "annualized_target": 0.10,
    "minimum_scale": 0.5, "maximum_scale": 1.0
  },
  "drawdown_brakes": [],
  "position_stop": {"enabled": false, "loss_fraction": 0.5, "cooldown_bars": 0},
  "time_stop": {"enabled": false, "maximum_holding_bars": 10, "cooldown_bars": 0},
  "turnover_limit": {"enabled": false, "maximum_one_way_turnover": 1.0},
  "side_scaling": {"long_scale": 1.0, "short_scale": 1.0}
}
