{
  "drawdown_brakes": [],
  "policy_id": "team-10-base",
  "position_stop": {
    "cooldown_bars": 3,
    "enabled": false,
    "loss_fraction": 0.1
  },
  "same_boundary_reentry": false,
  "schema_version": 1,
  "side_scaling": {
    "long_scale": 1.0,
    "short_scale": 1.0
  },
  "time_stop": {
    "cooldown_bars": 3,
    "enabled": false,
    "maximum_holding_bars": 21
  },
  "turnover_limit": {
    "enabled": false,
    "maximum_one_way_turnover": 1.0
  },
  "volatility_target": {
    "annualized_target": 0.4,
    "enabled": false,
    "lookback_days": 30,
    "maximum_scale": 1.0,
    "minimum_scale": 0.0
  }
}
