{
  "drawdown_brakes": [],
  "policy_id": "team-07-turnover-only",
  "position_stop": {"cooldown_bars": 3, "enabled": false, "loss_fraction": 0.12},
  "same_boundary_reentry": false,
  "schema_version": 1,
  "side_scaling": {"long_scale": 1.0, "short_scale": 1.0},
  "time_stop": {"cooldown_bars": 3, "enabled": false, "maximum_holding_bars": 21},
  "turnover_limit": {"enabled": true, "maximum_one_way_turnover": 0.35},
  "volatility_target": {
    "annualized_target": 0.35,
    "enabled": false,
    "lookback_days": 30,
    "maximum_scale": 1.0,
    "minimum_scale": 0.25
  }
}
