{
  "drawdown_brakes": [
    {
      "drawdown": 0.1,
      "gross_scale": 0.75
    },
    {
      "drawdown": 0.18,
      "gross_scale": 0.45
    },
    {
      "drawdown": 0.25,
      "gross_scale": 0.25
    }
  ],
  "policy_id": "team-06-drawdown-only-v1",
  "position_stop": {
    "cooldown_bars": 3,
    "enabled": false,
    "loss_fraction": 0.1
  },
  "same_boundary_reentry": false,
  "schema_version": 1,
  "side_scaling": {
    "long_scale": 1.0,
    "short_scale": 1.0
  },
  "time_stop": {
    "cooldown_bars": 3,
    "enabled": false,
    "maximum_holding_bars": 21
  },
  "turnover_limit": {
    "enabled": false,
    "maximum_one_way_turnover": 0.18
  },
  "volatility_target": {
    "annualized_target": 0.18,
    "enabled": false,
    "lookback_days": 30,
    "maximum_scale": 1.0,
    "minimum_scale": 0.3
  }
}
