{
  "drawdown_brakes": [
    {
      "drawdown": 0.07,
      "gross_scale": 0.7
    },
    {
      "drawdown": 0.14,
      "gross_scale": 0.35
    },
    {
      "drawdown": 0.21,
      "gross_scale": 0.0
    }
  ],
  "policy_id": "t04-breadth-switch-residual-b126-f84-s7-r63-g2200-v2",
  "position_stop": {
    "cooldown_bars": 9,
    "enabled": true,
    "loss_fraction": 0.08
  },
  "same_boundary_reentry": false,
  "schema_version": 1,
  "side_scaling": {
    "long_scale": 1.0,
    "short_scale": 1.0
  },
  "time_stop": {
    "cooldown_bars": 6,
    "enabled": true,
    "maximum_holding_bars": 126
  },
  "turnover_limit": {
    "enabled": true,
    "maximum_one_way_turnover": 0.12
  },
  "volatility_target": {
    "annualized_target": 0.22,
    "enabled": true,
    "lookback_days": 42,
    "maximum_scale": 1.0,
    "minimum_scale": 0.2
  }
}
