{
  "drawdown_brakes": [],
  "policy_id": "t05-long-reversal-f70-h28-hvtop5-v3",
  "position_stop": {
    "cooldown_bars": 6,
    "enabled": false,
    "loss_fraction": 0.09
  },
  "same_boundary_reentry": false,
  "schema_version": 1,
  "side_scaling": {
    "long_scale": 1.0,
    "short_scale": 1.0
  },
  "time_stop": {
    "cooldown_bars": 3,
    "enabled": false,
    "maximum_holding_bars": 84
  },
  "turnover_limit": {
    "enabled": false,
    "maximum_one_way_turnover": 0.12
  },
  "volatility_target": {
    "annualized_target": 0.22,
    "enabled": true,
    "lookback_days": 30,
    "maximum_scale": 1.0,
    "minimum_scale": 0.2
  }
}
