{
  "schema_version": 1,
  "policy_id": "t10-seasoning-age-cohorts-v1-controls-off",
  "same_boundary_reentry": false,
  "volatility_target": {
    "enabled": false,
    "lookback_days": 30,
    "annualized_target": 0.15,
    "minimum_scale": 0.5,
    "maximum_scale": 1.0
  },
  "drawdown_brakes": [],
  "position_stop": {
    "enabled": false,
    "loss_fraction": 0.1,
    "cooldown_bars": 3
  },
  "time_stop": {
    "enabled": false,
    "maximum_holding_bars": 84,
    "cooldown_bars": 3
  },
  "turnover_limit": {
    "enabled": false,
    "maximum_one_way_turnover": 0.8
  },
  "side_scaling": {
    "long_scale": 1.0,
    "short_scale": 1.0
  }
}
